{
  "slug": "tomlishorn",
  "page": {
    "title": "Tomlishorn (2120 m) -- Hike Plan",
    "generated": "2026-06-06",
    "year": 2026
  },
  "peak": {
    "name": "Tomlishorn",
    "elev": 2120,
    "lat": 46.97393,
    "lon": 8.24123
  },
  "index_card": {
    "region": "Pre-Alps",
    "canton": "Nidwalden",
    "distance": "9.8 km",
    "gain": "1211 m",
    "time": "~4h",
    "route_type": "point-to-point"
  },
  "trailhead": {
    "name": "Eigenthal, Eigenthalerhof",
    "elev": 1017,
    "lat": 47.0099,
    "lon": 8.2101,
    "sbb_url": "https://www.sbb.ch/en/buying/pages/fahrplan/fahrplan.xhtml?language=en&von=&nach=Eigenthal%2C+Eigenthalerhof"
  },
  "hero": {
    "image_url": "https://www.sac-cas.ch/processed/sa2020assetsprod/e/5/csm_1658912198_1111779650master_be64ca0bf3.jpg",
    "subtitle_html": "Eigenthal, Eigenthalerhof -> Tomlishorn -- <span class=\"pill t4\">SAC T4</span> | ~1211 m gain | ~9.8 km | ~4h",
    "grade": "T4",
    "auto_subtitle": true
  },
  "intro_html": "<p>Pilatus is one of the best known and most interesting mountains of the foothills of the Alps. A railway and an aerial cableway go up to the summit on Lake Lucerne, the former from the north (Kriens) and the latter from the south (Alpnachstad). However, despite the infrastructure for a large number of tourists Pilatus has a whole range of lone, secluded, surprising, multifaceted and sometimes challenging routes in store for you. The route presented here – the «Alte Tomliweg» – is a spectacular, but not too difficult route to the highest point of the massif, called Tomlishorn. From there you hike to the summit station of the railway and the cableway, which allows for an exciting ascent and a knee-friendly descent. Around Tomlishorn very often alpine ibex can be observed at close range.</p>",
  "quick_facts": [
    [
      "Summit elevation",
      "<strong>2120 m</strong>"
    ],
    [
      "SAC grade",
      "<span class=\"pill t4\">T4</span>"
    ],
    [
      "Trailhead",
      "Eigenthal, Eigenthalerhof"
    ],
    [
      "Distance",
      "9.8 km (out-and-back)"
    ],
    [
      "Total ascent",
      "~1211 m"
    ],
    [
      "Elevation range",
      "1017-2120 m"
    ]
  ],
  "photos": [
    {
      "url": "https://www.sac-cas.ch/processed/sa2020assetsprod/e/5/csm_1658912198_1111779650master_3af08a0ec9.jpg",
      "lightbox_url": "https://www.sac-cas.ch/processed/sa2020assetsprod/e/5/csm_1658912198_1111779650master_3af08a0ec9.jpg",
      "alt": "Route photo (SAC)",
      "caption_html": ""
    },
    {
      "url": "https://www.sac-cas.ch/processed/sa2020assetsprod/8/5/csm_1658912198_1547087315master_958b60ed2a.jpg",
      "lightbox_url": "https://www.sac-cas.ch/processed/sa2020assetsprod/8/5/csm_1658912198_1547087315master_958b60ed2a.jpg",
      "alt": "Route photo (SAC)",
      "caption_html": ""
    },
    {
      "url": "https://www.sac-cas.ch/processed/sa2020assetsprod/a/4/csm_1658397495_453093587master_7edb640cc6.jpg",
      "lightbox_url": "https://www.sac-cas.ch/processed/sa2020assetsprod/a/4/csm_1658397495_453093587master_7edb640cc6.jpg",
      "alt": "Route photo (SAC)",
      "caption_html": ""
    },
    {
      "url": "https://www.sac-cas.ch/processed/sa2020assetsprod/4/0/csm_1658397495_456187378master_b32d2f40d7.jpg",
      "lightbox_url": "https://www.sac-cas.ch/processed/sa2020assetsprod/4/0/csm_1658397495_456187378master_b32d2f40d7.jpg",
      "alt": "Route photo (SAC)",
      "caption_html": ""
    },
    {
      "url": "https://www.sac-cas.ch/processed/sa2020assetsprod/e/9/csm_1658397496_1425506033master_9eb356d6d1.jpg",
      "lightbox_url": "https://www.sac-cas.ch/processed/sa2020assetsprod/e/9/csm_1658397496_1425506033master_9eb356d6d1.jpg",
      "alt": "Route photo (SAC)",
      "caption_html": ""
    },
    {
      "url": "https://www.sac-cas.ch/processed/sa2020assetsprod/3/2/csm_1513341274_1941308109master_05e30ef0d9.jpg",
      "lightbox_url": "https://www.sac-cas.ch/processed/sa2020assetsprod/3/2/csm_1513341274_1941308109master_05e30ef0d9.jpg",
      "alt": "Route photo (SAC)",
      "caption_html": ""
    },
    {
      "url": "https://www.sac-cas.ch/processed/sa2020assetsprod/c/8/csm_1658397494_1461788689master_b009e96c42.jpg",
      "lightbox_url": "https://www.sac-cas.ch/processed/sa2020assetsprod/c/8/csm_1658397494_1461788689master_b009e96c42.jpg",
      "alt": "Route photo (SAC)",
      "caption_html": ""
    },
    {
      "url": "https://www.sac-cas.ch/processed/sa2020assetsprod/c/0/csm_1601641996_1561270344master_c62d6c8c56.jpg",
      "lightbox_url": "https://www.sac-cas.ch/processed/sa2020assetsprod/c/0/csm_1601641996_1561270344master_c62d6c8c56.jpg",
      "alt": "Route photo (SAC)",
      "caption_html": ""
    }
  ],
  "waypoints": [
    {
      "lat": 47.0099,
      "lon": 8.2101,
      "label": "Eigenthal, Eigenthalerhof (1017 m)",
      "kind": "start"
    },
    {
      "lat": 46.973655712269576,
      "lon": 8.240917832111997,
      "label": "Tomlishorn (2120 m)",
      "kind": "summit"
    }
  ],
  "routes": [
    {
      "title_html": "<strong>Alter Tomliweg</strong>",
      "grade": "T4",
      "pill_class": "t4",
      "source": "SAC Route Portal",
      "notes_html": "<p>Between Chastelen and Tomlishorn there are faint paths in the scree, followed by an exposed traverse on a one meter wide ledge and at the end some scrambling passages (fixed ropes). As the route lies mainly in the shadow, it is often wet (thus precarious), and in the spring you encounter treacherous fields of old snow.</p>",
      "bullets_html": []
    }
  ],
  "getting_there": {
    "by_pt_html": "<p><strong>Bus</strong> to <strong>Eigenthal, Eigenthalerhof</strong>.</p>"
  },
  "elev_chart_attrib_html": "Computed from the inlined GPX track (elevations from SwissTopo height API).",
  "end_point": {
    "name": "Pilatus Kulm, Bergstation",
    "elev": 2118,
    "sbb_url": "https://www.sbb.ch/en/buying/pages/fahrplan/fahrplan.xhtml?language=en&von=&nach=Pilatus+Kulm"
  },
  "photos_attrib_html": "All photos: SAC Route Portal",
  "sources": [
    {
      "name": "SAC Route Portal (route)",
      "url": "https://www.sac-cas.ch/en/huts-and-tours/sac-route-portal/tomlishorn-1988/mountain-hiking/alter-tomliweg-807/"
    },
    {
      "name": "SAC Route Portal (peak)",
      "url": "https://www.sac-cas.ch/en/huts-and-tours/sac-route-portal/tomlishorn-1988/mountain-hiking/"
    }
  ]
}
