{
  "slug": "badus-six-madun",
  "page": {
    "title": "Badus Six Madun (2874 m) -- Hike Plan",
    "generated": "2026-06-29",
    "year": 2026
  },
  "peak": {
    "name": "Badus Six Madun",
    "elev": 2874,
    "lat": 46.62251,
    "lon": 8.66367
  },
  "index_card": {
    "region": "Northern Alps",
    "canton": "Uri",
    "distance": "13.5 km",
    "gain": "1022 m",
    "time": "~4h30",
    "route_type": "point-to-point"
  },
  "trailhead": {
    "name": "Nätschen, Bahnhof",
    "elev": 1824,
    "lat": 46.642,
    "lon": 8.6106
  },
  "hero": {
    "image_url": "https://www.sac-cas.ch/processed/sa2020assetsprod/a/4/csm_1630674766_2137243796master_eb8710bde2.jpg",
    "subtitle_html": "Nätschen, Bahnhof -> Badus Six Madun -- <span class=\"pill t4\">SAC T4+</span> | ~1022 m gain | ~13.5 km | ~4h30",
    "grade": "T4+",
    "auto_subtitle": true
  },
  "intro_html": "<p>Badus is said to mean steep, reclining. But the same mountain has a second name, Six Madun. Six is a rock head, Madun (Madone) is a pillar or a column. Correspondingly the access via Six Madun Egg is a steep, inclined ramp with a rocky head.</p>\n<p>From Lai da Tuma a side trip of about 20 minutes brings you to the beautifully located Badushütte.</p>",
  "quick_facts": [
    [
      "Summit elevation",
      "<strong>2874 m</strong>"
    ],
    [
      "SAC grade",
      "<span class=\"pill t4\">T4+</span>"
    ],
    [
      "Trailhead",
      "Nätschen, Bahnhof"
    ],
    [
      "Distance",
      "13.5 km (out-and-back)"
    ],
    [
      "Total ascent",
      "~1022 m"
    ],
    [
      "Elevation range",
      "1824-2874 m"
    ]
  ],
  "photos": [
    {
      "url": "https://www.sac-cas.ch/processed/sa2020assetsprod/a/4/csm_1630674766_2137243796master_a827f2c663.jpg",
      "lightbox_url": "https://www.sac-cas.ch/processed/sa2020assetsprod/a/4/csm_1630674766_2137243796master_a827f2c663.jpg",
      "alt": "Route photo (SAC)",
      "caption_html": ""
    },
    {
      "url": "https://www.sac-cas.ch/processed/sa2020assetsprod/1/4/csm_1630676013_78741342master_9799d5e2db.jpg",
      "lightbox_url": "https://www.sac-cas.ch/processed/sa2020assetsprod/1/4/csm_1630676013_78741342master_9799d5e2db.jpg",
      "alt": "Route photo (SAC)",
      "caption_html": ""
    },
    {
      "url": "https://www.sac-cas.ch/processed/sa2020assetsprod/5/e/csm_1630675021_1385347994master_9a89828171.jpg",
      "lightbox_url": "https://www.sac-cas.ch/processed/sa2020assetsprod/5/e/csm_1630675021_1385347994master_9a89828171.jpg",
      "alt": "Route photo (SAC)",
      "caption_html": ""
    },
    {
      "url": "https://www.sac-cas.ch/processed/sa2020assetsprod/a/d/csm_1513339314_1930238714master_46f196be46.jpg",
      "lightbox_url": "https://www.sac-cas.ch/processed/sa2020assetsprod/a/d/csm_1513339314_1930238714master_46f196be46.jpg",
      "alt": "Route photo (SAC)",
      "caption_html": ""
    },
    {
      "url": "https://www.sac-cas.ch/processed/sa2020assetsprod/1/0/csm_1579611791_1790884637master_c718a2a292.jpg",
      "lightbox_url": "https://www.sac-cas.ch/processed/sa2020assetsprod/1/0/csm_1579611791_1790884637master_c718a2a292.jpg",
      "alt": "Route photo (SAC)",
      "caption_html": ""
    }
  ],
  "waypoints": [
    {
      "lat": 46.642,
      "lon": 8.6106,
      "label": "Nätschen, Bahnhof (1824 m)",
      "kind": "start"
    },
    {
      "lat": 46.62337296569697,
      "lon": 8.663642730057306,
      "label": "Badus Six Madun (2874 m)",
      "kind": "summit"
    }
  ],
  "routes": [
    {
      "title_html": "<strong>From Nätschen via Six Madun Egg (western rib) to Oberalppass</strong>",
      "grade": "T4+",
      "pill_class": "t4",
      "bullets_html": [],
      "source": "SAC Route Portal",
      "notes_html": "<p>Challenging route finding between Rossboden and the foot of Six Madun Egg. Six Madun Egg is grassy, interspersed with rocks and boulders. A path is visible almost on the entire segment. Some scrambling is needed right at the top, shortly before P. 2749. Some orientational skills are required, and the remoteness of the tour should not be underestimated. In wet conditions the route becomes challenging!</p>"
    }
  ],
  "getting_there": {
    "by_pt_html": "<p><strong>Train</strong> to <strong>Nätschen, Bahnhof</strong>.</p>"
  },
  "elev_chart_attrib_html": "Computed from the inlined GPX track (elevations from SwissTopo height API).",
  "end_point": {
    "name": "Oberalppass",
    "elev": 2041
  },
  "photos_attrib_html": "All photos: SAC Route Portal"
}
