{
  "slug": "schynige-platte-first",
  "page": {
    "title": "Schynige Platte – First (2681 m) -- Hike Plan",
    "generated": "2026-05-22",
    "year": 2026
  },
  "peak": {
    "name": "Faulhorn",
    "elev": 2681,
    "lat": 46.6571,
    "lon": 7.9481
  },
  "index_card": {
    "region": "Berner Oberland",
    "canton": "Bern",
    "distance": "7.4 km",
    "gain": "490 m",
    "time": "~2h30",
    "route_type": "point-to-point"
  },
  "trailhead": {
    "name": "Schynige Platte",
    "elev": 1970,
    "lat": 46.6519,
    "lon": 7.9107,
    "sbb_url": "https://www.sbb.ch/en/buying/pages/fahrplan/fahrplan.xhtml?language=en&von=&nach=Schynige+Platte"
  },
  "hero": {
    "image_url": "https://www.sac-cas.ch/processed/sa2020assetsprod/7/1/csm_1668417488_2142254707master_a87fc1adc7.jpg",
    "subtitle_html": "Schynige Platte -> Berghaus Männdlenen -- <span class=\"pill t2\">SAC T2</span> | ~490 m gain | ~7.4 km | ~2h30",
    "grade": "T2",
    "auto_subtitle": true
  },
  "intro_html": "<p>The definitive Berner Oberland ridge traverse: from Schynige Platte to First via Berghaus Männdlenen, Faulhorn, and Bachalpsee. The Eiger, Mönch, and Jungfrau are in view almost the entire way. The high point is the Faulhorn (2681 m) with its historic mountain hotel — the oldest in the Alps.</p>",
  "quick_facts": [
    [
      "Summit elevation",
      "<strong>2681 m</strong> (Faulhorn)"
    ],
    [
      "SAC grade",
      "<span class=\"pill t2\">T2</span>"
    ],
    [
      "Trailhead",
      "Schynige Platte"
    ],
    [
      "Distance",
      "7.4 km (out-and-back)"
    ],
    [
      "Total ascent",
      "~490 m"
    ],
    [
      "Elevation range",
      "1910-2344 m"
    ]
  ],
  "photos": [
    {
      "url": "https://www.sac-cas.ch/processed/sa2020assetsprod/d/7/csm_1534266885_1864266862master_a64e92af1f.jpg",
      "lightbox_url": "https://www.sac-cas.ch/processed/sa2020assetsprod/d/7/csm_1534266885_1864266862master_a64e92af1f.jpg",
      "alt": "Route photo (SAC)",
      "caption_html": ""
    }
  ],
  "waypoints": [
    {
      "lat": 46.65224480861517,
      "lon": 7.911173065975709,
      "label": "Schynige Platte (1967 m)",
      "kind": "start"
    },
    {
      "lat": 46.66892281810453,
      "lon": 7.968787902451804,
      "label": "Berghaus Männdlenen (2344 m)",
      "kind": "hut"
    },
    {
      "lat": 46.6571,
      "lon": 7.9481,
      "label": "Faulhorn (2681 m)",
      "kind": "summit"
    },
    {
      "lat": 46.6605,
      "lon": 8.0253,
      "label": "Bachalpsee (2265 m)",
      "kind": "poi"
    },
    {
      "lat": 46.659,
      "lon": 8.0576,
      "label": "First (2165 m)",
      "kind": "end"
    }
  ],
  "routes": [
    {
      "title_html": "<strong>Schynige Platte – First traverse</strong>",
      "grade": "T2",
      "pill_class": "t2",
      "bullets_html": [],
      "source": "<a href=\"https://www.sac-cas.ch/en/huts-and-tours/sac-route-portal/berghaus-maenndlenen-2147000162/mountain-hiking/von-schynige-platte-1467/\" target=\"_blank\" rel=\"noopener\">SAC Route Portal</a>"
    }
  ],
  "getting_there": {
    "by_pt_html": "<p><strong>Start:</strong> Cog railway from Wilderswil to <strong>Schynige Platte</strong>.</p>\n<p><strong>End:</strong> Gondola from <strong>First</strong> down to Grindelwald, then bus/train.</p>\n<p>Timetables: <a href=\"https://www.jungfrau.ch\">jungfrau.ch</a></p>"
  },
  "elev_chart_attrib_html": "Computed from the inlined GPX track (elevations from SwissTopo height API).",
  "sources": [
    {
      "name": "SAC Route Portal (Schynige Platte leg)",
      "url": "https://www.sac-cas.ch/en/huts-and-tours/sac-route-portal/berghaus-maenndlenen-2147000162/mountain-hiking/von-schynige-platte-1467/"
    },
    {
      "name": "SAC Route Portal (First leg)",
      "url": "https://www.sac-cas.ch/en/huts-and-tours/sac-route-portal/berghaus-maenndlenen-2147000162/mountain-hiking/von-first-1469/"
    },
    {
      "name": "SAC Route Portal (peak)",
      "url": "https://www.sac-cas.ch/en/huts-and-tours/sac-route-portal/berghaus-maenndlenen-2147000162/mountain-hiking/"
    }
  ],
  "photos_attrib_html": "All photos: SAC Route Portal"
}
