{
  "slug": "grand-chavalard",
  "page": {
    "title": "Grand Chavalard (2872 m) -- Hike Plan",
    "generated": "2026-06-19",
    "year": 2026
  },
  "peak": {
    "name": "Grand Chavalard",
    "elev": 2872,
    "lat": 46.17866,
    "lon": 7.11303
  },
  "index_card": {
    "region": "Valais Alps",
    "canton": "Valais",
    "distance": "14.3 km",
    "gain": "1343 m",
    "time": "~5h",
    "route_type": "out-and-back"
  },
  "trailhead": {
    "name": "Jorasse, Bergstation",
    "elev": 1946,
    "lat": 46.2036,
    "lon": 7.1406,
    "sbb_url": "https://www.sbb.ch/en/buying/pages/fahrplan/fahrplan.xhtml?language=en&von=&nach=Jorasse"
  },
  "hero": {
    "image_url": "https://www.sac-cas.ch/processed/sa2020assetsprod/3/0/csm_1588092021_1306806297master_441e8aade0.jpg",
    "subtitle_html": "Jorasse, Bergstation -> Grand Chavalard -- <span class=\"pill t5\">SAC T5-</span> | ~1343 m gain | ~14.3 km | ~5h",
    "grade": "T5-",
    "auto_subtitle": true
  },
  "intro_html": "<p>Imposant ragt der Grand Chavalard über dem Rhôneknie in den Höhe und eröffnet bei klarer Sicht wunderbare Blicke zum Mont-Blanc-Massiv und Grand Combin. Obwohl gerade mal 2901 m hoch, sind es vom Rhônetal 2440 m Höhendifferenz zum Gipfel - eine Besteigung vom Tal aus wäre ein strammes Konditionstraining. Zwar kann der Grand Chavalard als Tagestour bewältigt werden, eine Übernachtung z.B. der Cabane de Fenestral ist dennoch eine lohnende Sache – schliesslich ist das morgendliche Licht für die Gipfelschau am schönsten.</p>\n<p>Man sollte vermeiden, von Le Basse direkt auf den Grat zu gelangen (blaue Punkte). Der Fels ist hier sehr instabil!</p>",
  "quick_facts": [
    [
      "Summit elevation",
      "<strong>2872 m</strong>"
    ],
    [
      "SAC grade",
      "<span class=\"pill t5\">T5-</span>"
    ],
    [
      "Trailhead",
      "Jorasse, Bergstation"
    ],
    [
      "Distance",
      "14.3 km (out-and-back)"
    ],
    [
      "Total ascent",
      "~1343 m"
    ],
    [
      "Elevation range",
      "1662-2871 m"
    ]
  ],
  "photos": [
    {
      "url": "https://www.sac-cas.ch/processed/sa2020assetsprod/3/0/csm_1588092021_1306806297master_d456ed2cf5.jpg",
      "lightbox_url": "https://www.sac-cas.ch/processed/sa2020assetsprod/3/0/csm_1588092021_1306806297master_d456ed2cf5.jpg",
      "alt": "Route photo (SAC)",
      "caption_html": ""
    },
    {
      "url": "https://www.sac-cas.ch/processed/sa2020assetsprod/5/d/csm_1588167690_1436282926master_2ab7c8358a.jpg",
      "lightbox_url": "https://www.sac-cas.ch/processed/sa2020assetsprod/5/d/csm_1588167690_1436282926master_2ab7c8358a.jpg",
      "alt": "Route photo (SAC)",
      "caption_html": ""
    },
    {
      "url": "https://www.sac-cas.ch/processed/sa2020assetsprod/4/5/csm_1588167690_1134228958master_d401529511.jpg",
      "lightbox_url": "https://www.sac-cas.ch/processed/sa2020assetsprod/4/5/csm_1588167690_1134228958master_d401529511.jpg",
      "alt": "Route photo (SAC)",
      "caption_html": ""
    },
    {
      "url": "https://www.sac-cas.ch/processed/sa2020assetsprod/9/8/csm_1587651030_1242105755master_9be49e03d0.jpg",
      "lightbox_url": "https://www.sac-cas.ch/processed/sa2020assetsprod/9/8/csm_1587651030_1242105755master_9be49e03d0.jpg",
      "alt": "Route photo (SAC)",
      "caption_html": ""
    },
    {
      "url": "https://www.sac-cas.ch/processed/sa2020assetsprod/4/d/csm_1588165436_55078465master_6224fcf262.jpg",
      "lightbox_url": "https://www.sac-cas.ch/processed/sa2020assetsprod/4/d/csm_1588165436_55078465master_6224fcf262.jpg",
      "alt": "Route photo (SAC)",
      "caption_html": ""
    },
    {
      "url": "https://www.sac-cas.ch/processed/sa2020assetsprod/c/5/csm_1587650861_1971323977master_216abf106e.jpg",
      "lightbox_url": "https://www.sac-cas.ch/processed/sa2020assetsprod/c/5/csm_1587650861_1971323977master_216abf106e.jpg",
      "alt": "Route photo (SAC)",
      "caption_html": ""
    },
    {
      "url": "https://www.sac-cas.ch/processed/sa2020assetsprod/8/b/csm_1729166849_658009205master_0ed5f70bcc.jpg",
      "lightbox_url": "https://www.sac-cas.ch/processed/sa2020assetsprod/8/b/csm_1729166849_658009205master_0ed5f70bcc.jpg",
      "alt": "Route photo (SAC)",
      "caption_html": ""
    },
    {
      "url": "https://www.sac-cas.ch/processed/sa2020assetsprod/c/4/csm_1587650746_282111987master_aa74265b29.jpg",
      "lightbox_url": "https://www.sac-cas.ch/processed/sa2020assetsprod/c/4/csm_1587650746_282111987master_aa74265b29.jpg",
      "alt": "Route photo (SAC)",
      "caption_html": ""
    },
    {
      "url": "https://www.sac-cas.ch/processed/sa2020assetsprod/c/d/csm_1587650720_161688031master_cd18c2a42b.jpg",
      "lightbox_url": "https://www.sac-cas.ch/processed/sa2020assetsprod/c/d/csm_1587650720_161688031master_cd18c2a42b.jpg",
      "alt": "Route photo (SAC)",
      "caption_html": ""
    },
    {
      "url": "https://www.sac-cas.ch/processed/sa2020assetsprod/7/7/csm_1587650661_1741388226master_ebabff4817.jpg",
      "lightbox_url": "https://www.sac-cas.ch/processed/sa2020assetsprod/7/7/csm_1587650661_1741388226master_ebabff4817.jpg",
      "alt": "Route photo (SAC)",
      "caption_html": ""
    },
    {
      "url": "https://www.sac-cas.ch/processed/sa2020assetsprod/5/e/csm_1587650602_1864907775master_9aee4de940.jpg",
      "lightbox_url": "https://www.sac-cas.ch/processed/sa2020assetsprod/5/e/csm_1587650602_1864907775master_9aee4de940.jpg",
      "alt": "Route photo (SAC)",
      "caption_html": ""
    }
  ],
  "waypoints": [
    {
      "lat": 46.2036,
      "lon": 7.1406,
      "label": "Jorasse, Bergstation (1946 m)",
      "kind": "start"
    },
    {
      "lat": 46.178392467626026,
      "lon": 7.112640049349054,
      "label": "Grand Chavalard (2871 m)",
      "kind": "summit"
    }
  ],
  "routes": [
    {
      "title_html": "<strong>Überschreitung Nordgrat - Südgrat</strong>",
      "grade": "T5-",
      "pill_class": "t5",
      "source": "SAC Route Portal",
      "notes_html": "<p>Trittsicherheit und Schwindelfreiheit auf dem weglosen Nordgrat erforderlich. Markierter, aber sehr steiler Abstieg über den Südgrat (T3+/T4-). Knieschonender wäre die Tour eigentlich in umgekehrter Richtung. Man sollte vermeiden, von Le Basse direkt auf den Grat zu gelangen (blaue Punkte). Der Fels ist hier sehr instabil!</p>",
      "bullets_html": []
    }
  ],
  "getting_there": {
    "by_pt_html": "<p><strong>Train</strong> to <strong>Jorasse, Bergstation</strong>.</p>"
  },
  "elev_chart_attrib_html": "Computed from the inlined GPX track (elevations from SwissTopo height API).",
  "photos_attrib_html": "All photos: SAC Route Portal",
  "sources": [
    {
      "name": "SAC Route Portal (route)",
      "url": "https://www.sac-cas.ch/en/huts-and-tours/sac-route-portal/grand-chavalard-364/mountain-hiking/ueberschreitung-nordgrat-suedgrat-6262/"
    },
    {
      "name": "SAC Route Portal (peak)",
      "url": "https://www.sac-cas.ch/en/huts-and-tours/sac-route-portal/grand-chavalard-364/mountain-hiking/"
    }
  ]
}
